{
  "$schema": "../../../schemas/spec-capabilities.schema.json",
  "schemaVersion": 1,
  "recordType": "spec-capabilities",
  "id": "hunter/marksmanship/capabilities",
  "status": "corroborated",
  "validity": { "fromBuild": "12.1.0.69587", "untilBuild": null, "seasonId": null, "seasonSlug": "midnight-season-2" },
  "spec": { "classId": 3, "className": "Hunter", "specId": 254, "specName": "Marksmanship", "slug": "marksmanship-hunter" },
  "tools": [
    { "id": "counter-shot", "name": "Counter Shot", "spellId": 147362, "actions": ["interrupt"], "availability": "talent", "scope": "enemy", "limitations": ["Requires a ranged weapon", "Single target", "Twenty-four-second cooldown"] },
    { "id": "tranquilizing-shot", "name": "Tranquilizing Shot", "spellId": 19801, "actions": ["purge", "soothe"], "availability": "talent", "scope": "enemy", "limitations": ["Removes one beneficial Magic effect and one Enrage effect", "Single target"] },
    { "id": "intimidation", "name": "Intimidation", "spellId": 19577, "actions": ["crowd-control"], "availability": "talent", "scope": "enemy", "limitations": ["Uses the Marksmanship Spotting Eagle instead of a pet", "Only affects stunnable enemies", "One-minute cooldown"] },
    { "id": "harriers-cry", "name": "Harrier's Cry", "spellId": 466904, "actions": ["bloodlust"], "availability": "specialization", "scope": "friendly-area", "limitations": ["Applies the ten-minute Sated lockout"] },
    { "id": "aspect-of-the-turtle", "name": "Aspect of the Turtle", "spellId": 186265, "actions": ["defensive"], "availability": "baseline", "scope": "self", "limitations": ["Personal defense only", "Prevents attacking while active", "Does not remove damage-over-time effects already applied"] },
    { "id": "survival-of-the-fittest", "name": "Survival of the Fittest", "spellId": 281195, "actions": ["defensive"], "availability": "talent", "scope": "self", "limitations": ["Personal mitigation only", "Brief duration"] }
  ],
  "provenance": [
    { "kind": "external-reference", "description": "Current Marksmanship Hunter ability guide identifies the specialization's interrupt, enemy Magic and Enrage removal, control, and defensive tools.", "url": "https://www.wowhead.com/guide/classes/hunter/marksmanship/abilities-talents-pve-dps", "retrievedAt": "2026-09-02T17:35:00+02:00" },
    { "kind": "external-reference", "description": "Current Counter Shot spell record confirms its interrupt, range, lockout, and cooldown.", "url": "https://www.wowhead.com/spell=147362/counter-shot", "retrievedAt": "2026-09-02T17:35:00+02:00" },
    { "kind": "external-reference", "description": "Current Intimidation spell record confirms the single-target stun and cooldown; the Marksmanship guide documents its Spotting Eagle implementation.", "url": "https://www.wowhead.com/spell=19577/intimidation", "retrievedAt": "2026-09-02T17:35:00+02:00" },
    { "kind": "external-reference", "description": "Current Harrier's Cry record confirms Marksmanship's innate Bloodlust equivalent and shared Sated lockout.", "url": "https://www.wowhead.com/spell=466904/harriers-cry", "retrievedAt": "2026-09-02T18:50:00+02:00" }
  ]
}
