{
  "$schema": "../../../schemas/spec-capabilities.schema.json",
  "schemaVersion": 1,
  "recordType": "spec-capabilities",
  "id": "warlock/affliction/capabilities",
  "matrixRecordId": "midnight-season-2/affliction-warlock-utility-matrix",
  "status": "corroborated",
  "validity": { "fromBuild": "12.1.0.69587", "untilBuild": null, "seasonId": null, "seasonSlug": "midnight-season-2" },
  "spec": { "classId": 9, "className": "Warlock", "specId": 265, "specName": "Affliction", "slug": "affliction-warlock" },
  "tools": [
    { "id": "create-soulwell", "name": "Create Soulwell", "spellId": 29893, "alternateSpellIds": [6262], "actions": ["group-consumable"], "availability": "baseline", "scope": "friendly-area", "limitations": ["Party members must collect a Healthstone from the Soulwell", "Healthstone is a personal consumable after collection", "Healthstone has its own use cooldown"] },
    { "id": "soulstone", "name": "Soulstone", "spellId": 20707, "actions": ["battle-resurrection"], "availability": "baseline", "scope": "friendly-single", "limitations": ["Uses the shared combat-resurrection resource in combat", "Can be applied before combat for self-resurrection planning", "Long cast outside Soulburn interactions"] },
    { "id": "demonic-gateway", "name": "Demonic Gateway", "spellId": 111771, "actions": ["group-movement"], "availability": "talent", "scope": "friendly-area", "limitations": ["Requires placement and party interaction", "Connects two fixed endpoints rather than granting free movement", "Route skips are dungeon- and placement-specific"] },
    { "id": "shadowfury", "name": "Shadowfury", "spellId": 30283, "actions": ["crowd-control"], "availability": "talent", "scope": "area-enemy", "limitations": ["Stuns only susceptible enemies", "Stopped enemies can recast after the stun", "Does not provide a spell-school lockout"] },
    { "id": "curse-of-tongues", "name": "Curse of Tongues", "spellId": 1714, "actions": ["enemy-output-slow"], "availability": "talent", "scope": "enemy", "requirements": [{ "kind": "configuration", "value": "Foul Mouth changes the single-target curse into a ten-yard application around the target" }], "limitations": ["Slows spell casting rather than interrupting", "Only one Curse or Blight can be active per target"] },
    { "id": "blight-of-tongues", "name": "Blight of Tongues", "spellId": 1271802, "actions": ["enemy-output-slow"], "availability": "talent", "scope": "area-enemy", "limitations": ["Two-minute cooldown", "Twelve-second duration", "Only one Curse or Blight can be active per target"] },
    { "id": "blight-of-weakness", "name": "Blight of Weakness", "spellId": 1265799, "actions": ["enemy-damage-reduction"], "availability": "talent", "scope": "area-enemy", "limitations": ["Primarily reduces attack frequency and critical-strike chance", "Only one Curse or Blight can be active per target"] },
    { "id": "singe-magic", "name": "Singe Magic", "spellId": 89808, "actions": ["cleanse-magic"], "availability": "baseline", "scope": "friendly-single", "requirements": [{ "kind": "configuration", "value": "Requires an active Imp or another configuration that grants Singe Magic" }], "limitations": ["Removes one harmful Magic effect", "Pet choice can trade away another demon's utility"] },
    { "id": "devour-magic", "name": "Devour Magic", "spellId": 19505, "actions": ["purge"], "availability": "baseline", "scope": "enemy", "requirements": [{ "kind": "configuration", "value": "Requires an active Felhunter, Fel Ravager window, or another configuration that grants Devour Magic" }], "limitations": ["Removes one beneficial Magic effect from an enemy", "Availability depends on active demon or talent window"] },
    { "id": "spell-lock", "name": "Spell Lock", "spellId": 19647, "actions": ["interrupt"], "availability": "baseline", "scope": "enemy", "requirements": [{ "kind": "configuration", "value": "Requires an active Felhunter or another configuration that grants Spell Lock" }], "limitations": ["Pet-dependent interrupt", "Only interrupts interruptible casts", "Choosing another demon can remove access"] },
    { "id": "soulburn-demonic-circle", "name": "Soulburn: Demonic Circle", "spellId": 48020, "alternateSpellIds": [48018, 385899], "actions": ["cleanse-snare", "cleanse-root"], "availability": "talent", "scope": "self", "requirements": [{ "kind": "talent", "value": "Requires Soulburn and a pre-positioned Demonic Circle" }], "limitations": ["Self-only", "Requires advance placement and a Soul Shard", "Movement-immunity behavior is timing-sensitive"] }
  ],
  "provenance": [
    { "kind": "external-reference", "description": "Patch 12.1.0 Affliction Warlock Mythic+ guide identifies current reusable utility, dungeon interactions, and affix usage.", "url": "https://www.wowhead.com/guide/classes/warlock/affliction/mythic-plus-dungeon-tips", "retrievedAt": "2026-09-02T19:34:37+02:00" },
    { "kind": "external-reference", "description": "Current spell records establish Healthstone, Soulstone, Gateway, curse, pet-dispel, and control semantics.", "url": "https://www.wowhead.com/spell=29893/create-soulwell", "retrievedAt": "2026-09-02T19:34:37+02:00" },
    { "kind": "external-reference", "description": "Current Foul Mouth and Blight records establish configured area application and one-Curse-or-Blight limits.", "url": "https://www.wowhead.com/spell=1265813/foul-mouth", "retrievedAt": "2026-09-02T19:34:37+02:00" }
  ]
}
