{
  "$schema": "../../../schemas/spec-capabilities.schema.json",
  "schemaVersion": 1,
  "recordType": "spec-capabilities",
  "id": "mage/arcane/capabilities",
  "status": "corroborated",
  "validity": { "fromBuild": "12.1.0.69587", "untilBuild": null, "seasonId": null, "seasonSlug": "midnight-season-2" },
  "spec": { "classId": 8, "className": "Mage", "specId": 62, "specName": "Arcane", "slug": "arcane-mage" },
  "tools": [
    { "id": "counterspell", "name": "Counterspell", "spellId": 2139, "actions": ["interrupt"], "availability": "baseline", "scope": "enemy", "limitations": ["Single target", "Forty-yard range", "Twenty-five-second cooldown before Quick Witted"] },
    { "id": "spellsteal", "name": "Spellsteal", "spellId": 30449, "actions": ["purge"], "availability": "talent", "scope": "enemy", "limitations": ["Steals one beneficial Magic effect instead of merely removing it", "High mana cost"] },
    { "id": "remove-curse", "name": "Remove Curse", "spellId": 475, "actions": ["cleanse-curse"], "availability": "talent", "scope": "friendly-single", "limitations": ["Curse effects only", "Eight-second cooldown before Improved Remove Curse"] },
    { "id": "polymorph", "name": "Polymorph", "spellId": 118, "actions": ["crowd-control"], "availability": "baseline", "scope": "enemy", "limitations": ["Damage breaks the effect", "Only affects susceptible creature types"] },
    { "id": "time-warp", "name": "Time Warp", "spellId": 80353, "actions": ["bloodlust"], "availability": "baseline", "scope": "friendly-area", "limitations": ["Thirty percent Haste for forty seconds", "Applies the shared ten-minute exhaustion effect", "Five-minute cooldown"] },
    { "id": "arcane-intellect", "name": "Arcane Intellect", "spellId": 1459, "actions": ["group-buff"], "availability": "baseline", "scope": "friendly-area", "limitations": ["Three percent Intellect for one hour", "Does not stack with an equivalent Arcane Intellect effect"] },
    { "id": "prismatic-barrier", "name": "Prismatic Barrier", "spellId": 235450, "actions": ["defensive"], "availability": "talent", "scope": "self", "limitations": ["Personal absorb and Magic mitigation only"] }
  ],
  "provenance": [
    { "kind": "external-reference", "description": "Current Midnight Arcane guide identifies Time Warp, Counterspell, Arcane Intellect, Spellsteal, Remove Curse, Polymorph, and Prismatic Barrier.", "url": "https://www.wowhead.com/guide/classes/mage/arcane/abilities-talents-pve-dps", "retrievedAt": "2026-09-02T16:30:00+02:00" },
    { "kind": "external-reference", "description": "Current Time Warp record confirms Mage Bloodlust-equivalent behavior, duration, shared lockout, and spell identifier.", "url": "https://www.wowhead.com/spell=80353/time-warp", "retrievedAt": "2026-09-02T16:30:00+02:00" },
    { "kind": "external-reference", "description": "Current Arcane Intellect record confirms the party-wide three-percent Intellect effect.", "url": "https://www.wowhead.com/spell=1459/arcane-intellect", "retrievedAt": "2026-09-02T16:30:00+02:00" }
  ]
}
