{
  "$schema": "../../../schemas/spec-capabilities.schema.json",
  "schemaVersion": 1,
  "recordType": "spec-capabilities",
  "id": "shaman/enhancement/capabilities",
  "status": "corroborated",
  "validity": { "fromBuild": "12.1.0.69587", "untilBuild": null, "seasonId": null, "seasonSlug": "midnight-season-2" },
  "spec": { "classId": 7, "className": "Shaman", "specId": 263, "specName": "Enhancement", "slug": "enhancement-shaman" },
  "tools": [
    { "id": "wind-shear", "name": "Wind Shear", "spellId": 57994, "actions": ["interrupt"], "availability": "talent", "scope": "enemy", "limitations": ["Single target", "Requires an interruptible cast"] },
    { "id": "purge", "name": "Purge", "spellId": 370, "actions": ["purge"], "availability": "talent", "scope": "enemy", "limitations": ["Removes one beneficial Magic effect"] },
    { "id": "cleanse-spirit", "name": "Cleanse Spirit", "spellId": 51886, "actions": ["cleanse-curse"], "availability": "talent", "scope": "friendly-single", "limitations": ["Does not remove harmful Magic effects", "Eight-second cooldown"] },
    { "id": "poison-cleansing-totem", "name": "Poison Cleansing Totem", "spellId": 383013, "actions": ["cleanse-poison"], "availability": "talent", "scope": "friendly-periodic-area", "limitations": ["Cleanses one nearby ally every 1.5 seconds for 6 seconds", "Two-minute cooldown"] },
    { "id": "capacitor-totem", "name": "Capacitor Totem", "spellId": 192058, "actions": ["crowd-control"], "availability": "talent", "scope": "area-enemy", "limitations": ["Two-second arming delay", "Only affects stunnable enemies"] },
    { "id": "astral-shift", "name": "Astral Shift", "spellId": 108271, "actions": ["defensive"], "availability": "talent", "scope": "self", "limitations": ["Personal mitigation only"] }
  ],
  "provenance": [
    { "kind": "external-reference", "description": "Current Enhancement Shaman dungeon utility recommendations and tool selection.", "url": "https://www.wowhead.com/guide/classes/shaman/enhancement/mythic-plus-dungeon-tips", "retrievedAt": "2026-09-02T15:40:00+02:00" },
    { "kind": "external-reference", "description": "Current Cleanse Spirit record confirms curse-only friendly removal for Enhancement.", "url": "https://www.wowhead.com/spell=51886/cleanse-spirit", "retrievedAt": "2026-09-02T15:40:00+02:00" }
  ]
}
